プログラムデータを一時的に保存するために使用され、コンピュータの電源を落とした時にデータが消去されるのは、次のうちどれですか。,CPU,SSD,ハードディスク,システムメモリー,システムメモリー
OSやアプリケーションのセキュリティの強化を可能にするパッチの適用のうち、ベンダー管理による更新を可能にし、ユーザーの負担が最も少ない方法は、次のうちどれですか。,定期的なアップグレード,頻繁なパッチあて,自動アップデート,デイリーでスケジュールされたパッチ,自動アップデート
ケーブルロックを使用することで軽減することができるセキュリティ上の脅威は、次のうちどれですか。,ショルダーサーフィン,フィッシング,ハードウェアの盗難,ダンプスターダイビング（ゴミ箱あさり）,ハードウェアの盗難
パスワードを複雑にすることが必要とされる理由は、次のうちどれですか。,パスワードをクラックするのがより難しくなるため,ユーザーがパスワードを忘れないよう、書き留めることを促すため,ユーザーのタイピングスキルを向上させるため,ユーザーが別のアカウントで同じパスワードを使用しないようにするため,パスワードをクラックするのがより難しくなるため
ユーザーは、リンクを含むメールを受信しました。リンクにカーソルを置くと、実際のURLは、メールに記載されているテキストと一致せず、ランダムな文字列として表示されています。最適な処置は、次のうちどれですか。,知人にメールを転送し、アドバイスをもらう,送信者に返信し、リンクへの接続が安全かどうか尋ねる,リンクをクリックせず、メールを削除する,マルウェア対策ソフトがインストールされているのでリンクをクリックしてみる,リンクをクリックせず、メールを削除する
コンピュータオペレーションにおいて、一時的なストレージとして動作するコンポーネントは、次のうちどれですか。,システムボード,CPU (Central processing unit),RAM (Random access memory),拡張カード,RAM (Random access memory)
拡張子に .rtf がつくファイルの種類は、次のうちどれですか。,文書,実行ファイル,音声,表計算,文書
ノートPCやPC（ワークステーション）の物理的な盗難を防ぐ方法として一般的なのは、次のうちどれですか。,いかなる機密情報は処分する前に、細断する,パスワードをコンピュータの近くに置かない,パスワード/暗証番号を入力するときの認識力を養う,ケーブルと鍵は、固定された物にしっかりと取り付ける,ケーブルと鍵は、固定された物にしっかりと取り付ける
新しいソフトウェアアプリケーションをインストールした後、ユーザーは、そのアプリケーションが試用版として起動することに気が付きました。アプリケーションをアクティベーションするために実行する必要があるのは、次のうちどれですか。,プロダクトまたはライセンスキーを入力する,ベンダーサポートに連絡する,ソフトウェアアプリケーションを再インストールする,ソフトウェアインストールを完了させる,プロダクトまたはライセンスキーを入力する
あるユーザーのノートPCのハードディスクには、機密情報が含まれており、そのPCを会社のネットワークに時々接続します。その際、ユーザーの機密情報ファイルが、別のPCから閲覧されていることに気が付きました。この状況を防止するための方法は、次のうちどれですか。,ノートPC上で、ファイルとプリンターの共有を無効にする,ネットワークから使っていないドライブを削除する,キーリングから共有キーを削除する,ファイル上のリードオンリー属性を設定する,ノートPC上で、ファイルとプリンターの共有を無効にする
ユーザーのマイナンバー、誕生日、現住所などの情報があてはまるのは、次のうちどれですか。,IMAP,HTTP,PII,HTTPS,PII
CPUの機能説明として当てはまるのは、次のうちどれですか。,遠隔伝送のためデータを暗号化する,データ計算を実行する,コンポーネントに電力を供給する,ファイルの格納先を提供する,データ計算を実行する
OSのアクティベーションを実行した際に、ソフトウェアが純正ではない可能性があるというメッセージが表示されました。ここで発生していると考えられるセキュリティ脅威は、次のうちどれですか。,ソーシャルエンジニアリング,フィッシング,ウイルス攻撃,ライセンス盗難,ライセンス盗難
ユーザーは、SOHOワイヤレスルーターを設定しています。ユーザーが、ルータのデフォルトの管理者パスワードを変更すべき理由は、次のうちどれですか。,不適切なデータ送信暗号化を防止するため,不正な設定変更を防止するため,ソーシャルエンジニアリング攻撃を防止するため,ワイヤレスシグナルの強度を高めるため,不正な設定変更を防止するため
ユーザーは、8GBのRAMを動作条件とするCADアプリケーションの導入を検討しています。必要となるOSのタイプは、次のうちどれですか。,8-bit,16-bit,32-bit,64-bit,64-bit
複数のユーザー間で、あるフォルダ共有利用する必要があり、要件として高可用性が重要です。最適なソリューションは、次のうちどれですか。,PCに接続された容量の大きなUSBメモリ,中容量程度のSATAハードドライブ,ネットワークアタッチトストレージアプライアンス,セキュリティ機能を搭載したファイアウォール,ネットワークアタッチトストレージアプライアンス
内部システム機器の相互接続について責任を持つコンポーネントは、次のうちどれですか。,システムケース,電源,マザーボード,拡張カード,マザーボード
コンピュータを悪意ある攻撃から保護するソフトウェアは、次のうちどれですか。,バックアップ,アンチウイルス,ダイアグノスティック,スクリーンセーバー,アンチウイルス
ビデオ、オーディオ、ネットワークカードを接続するために使用されるコンピュータの内部コンポーネントは、次のうちどれですか。,CPU,マザーボード,ハードドライブ,モデム,マザーボード
コンピュータの温度を正常範囲内に保つため最も重要な事は、次のうちどれですか。,一定の出力を維持する,十分なエアフローを確保する,ケースを開けたままにしておく,不要時は、ワイヤレスをオフにしておく,十分なエアフローを確保する
従業員が使用しているデスクの電話機には、ネットワークケーブルのみが接続されています。この電話機で使用されていると考えられる技術は、次のうちどれですか。,LTE,GSM,VoIP,CDMA,VoIP
複数のファイルを統合するために使用されるファイル形式は、次のうちどれですか。,rtf,m3u,avi,rar,rar
.batファイルを実行する際に必要な権限は、次のうちどれですか。,削除,実行,書き込み,変更,実行
技術者がワークステーションにOSをインストールした後、画面上ですべてが大きなウインドウサイズで表示され、表示領域が制限されていることに気が付きました。この症状を解決するために設定する必要があると考えられるのは、次のうちどれですか。,色深度,向き,DPI設定,解像度,解像度
2台の新しいスマートフォン間で、同一のWiFiネットワークに接続することなく、ファイルを最も簡単かつ迅速に共有できる方法は、次のうちどれですか。,Micro SDカード,Bluetooth,USB接続,赤外線,Bluetooth
技術者は、新しいコンピュータを設置しました。ケーブル管理において、最良の方法であるのは、次のうちどれですか。,ケーブルをきれいに整列させ、ケーブルタイでまとめる,ケーブル間の干渉を防ぐため、緩めたままにしておく,ケーブルを壁に固定する,カーペットの下にケーブルをきれいに敷く,ケーブルをきれいに整列させ、ケーブルタイでまとめる
ユーザーは、ノートPCにメジャーアップデートを実行しようとしています。アップデート実行前に、行うべき作業は、次のうちどれですか。,バックアップからフォルダを復元する,管理者アカウントのパスワードを変更する,重要なフォルダをバックアップする,すべての個人的なドキュメントを印刷する,重要なフォルダをバックアップする
以下のプリンタ接続方法において、最も高速にデータ転送できる方式は、次のうちどれですか。,Bluetooth,USB,パラレル,シリアル,USB
ユーザーは、Eメールアカウントの初期パスワードを変更する必要があります。複雑なパスワードの例として最も適切であると考えられるのは、次のうちどれですか。,01#iWant!2686612338,iWantobeaCosmonau#,01c234n56789v9876x21,012iWanttobe210,01#iWant!2686612338
64-bitのOSを使用する利点は、次のうちどれですか。,SSDを認識することができる,IPv6アドレスを取得することができる,より多くのRAMを活用することができる,2つ以上のハードドライブを追加することができる,より多くのRAMを活用することができる
ユーザーは、ホテルの共用ワークステーションでのインターネットの閲覧をしました。個人情報保護の観点から、最後に実行すべきステップは、次のうちどれですか。,ゲストアカウントからログアウトし、再起動する,ブラウザ、拡張機能、プラグインを更新する,ワークステーションのウイルススキャンを実行する,ブラウザのキャッシュ、クッキー、履歴をクリアにする,ブラウザのキャッシュ、クッキー、履歴をクリアにする