65,13,valid,select,M,ハッシュの説明として適切なものはどれか、次の選択肢の中から１つ選びなさい,ハッシュ値から平文を計算により求めることは困難である,ハッシュ値は可変長のデータである,同じ平文からも常に異なるハッシュ値が求められるため、改ざんが検知できる,暗号化や復号を行う方式の１つである,,,ハッシュ値から平文を計算により求めることは困難である,,0,0
66,13,valid,select,M,代表的なハッシュアルゴリズムはどれか、次の選択肢の中から１つ選びなさい,PKI,WPA,RSA,SHA1,,,SHA1,,0,0
67,13,valid,select,M,ハッシュの特徴として適切でないものはどれか、次の選択肢の中から１つ選びなさい,任意の長さの入力データに対して、固定長のハッシュ値を出力する,ハッシュ値からは元のデータを復元することができる,同じ入力データからは同じハッシュ値が出力される,入力データの僅かな変化に対してもハッシュ値は大きく変化する,,,ハッシュ値からは元のデータを復元することができる,,0,0
68,14,valid,select,M,電子証明書に含まれるデータとして正しいものはどれか、次の選択肢の中から１つ選びなさい,電子証明書の発行者の秘密鍵,電子証明書の申請者の秘密鍵,電子証明書の発行者の公開鍵,電子証明書の申請者の公開鍵,,,電子証明書の申請者の公開鍵,,0,0
69,14,valid,select,M,電子証明書の説明として適切なものはどれか、次の選択肢の中から１つ選びなさい,自治体が発行する電子データ,暗号化通信を行うための暗号鍵のデータ,電子データであることを保証するもの,添付された公開鍵が電子証明書の申請者のものであることを証明するデータ,,,添付された公開鍵が電子証明書の申請者のものであることを証明するデータ,,0,0
70,14,valid,select,M,認証局の役割として適切でないものはどれか、次の選択肢の中から１つ選びなさい,電子証明書をリポジトリに登録,失効した電子証明書の管理,電子証明書の申請の受付,電子政府の運営,,,電子政府の運営,,0,0
71,14,valid,select,M,PKIの説明として適切なものはどれか、次の選択肢の中から１つ選びなさい,送られてきたデータに改ざんが行なわれていないかを検証する技術,公開鍵が本物であることを証明するデータ,NISTによって選定作業が行なわれた次世代標準暗号化方式,公開鍵暗号を基盤とした技術や仕組みの総称,,,公開鍵暗号を基盤とした技術や仕組みの総称,,0,0
72,15,valid,select,M,SSHプロトコルの特徴として適切でないものはどれか、次の選択肢の中から１つ選びなさい,ポートフォワーディングを利用して、簡易的なVPNを構築できる,SSLプロトコルを利用したシェルプログラムである,通信の認証に公開鍵暗号方式を採用している,通信時に共通鍵暗号方式を採用している,,,SSLプロトコルを利用したシェルプログラムである,,0,0
73,15,valid,select,M,セキュリティプロトコルの説明として適切でないものはどれか、次の選択肢の中から１つ選びなさい,S/MIMEでは公開鍵の交換に電子証明書を利用するため、あらかじめ電子証明書の取得が必要になる,SSHのポートフォワーディング機能を用いることで暗号化や認証の機能を持たないプロトコルをSSHの暗号化や認証機能を利用できる,SSLでは公開鍵暗号方式は利用するものの、電子証明書は必要ないので、利便性が高い,IPsecはIPパケットを暗号化、認証する仕組みである,,,SSLでは公開鍵暗号方式は利用するものの、電子証明書は必要ないので、利便性が高い,,0,0
74,15,valid,select,M,IPv6の説明として適切なものはどれか、次の選択肢の中から１つ選びなさい,IPv6では、ユーザ認証を行なわない,IPv4よりも、多くのIPアドレスが利用できる,IPsecによるネットワークセキュリティの統一が可能である,通信帯域をコントロールすることができる,,,IPv4よりも、多くのIPアドレスが利用できる,,0,0
75,16,valid,select,M,電気分野を除く工業分野の国際的な標準規定を策定するための団体はどれか、次の選択肢の中から１つ選びなさい,ISO,IETF,OECD,JIS,,,ISO,,0,0
76,16,valid,select,M,個人情報保護法で、個人情報として扱われない情報はどれか、次の選択肢の中から１つ選びなさい,生年月日、連絡先、本人の氏名が入った情報,個人名が使用されたメールアドレス,氏名のみ記載された街角アンケート情報,死者に関する情報で、生存する喪主の情報が含まれたもの,,,氏名のみ記載された街角アンケート情報,,0,0
77,16,valid,select,M,情報政策における、日本国としての方針や理念を提示したものはどれか、次の選択肢の中から１つ選びなさい,高度情報処理ネットワーク社会形成基本法,電子署名法,電気通信法,書作権法,,,高度情報処理ネットワーク社会形成基本法,,0,0
78,16,valid,select,M,情報技術に関連した製品およびシステムに組み込まれているセキュリティを客観的に評価するための国際標準規格はどれか、次の選択肢の中から１つ選びなさい,ISO/IEC17799(ISO/IEC27002),ISO/IEC15408,ISO/IEC27001,ISO/IEC13335,,,ISO/IEC15408,,0,0
79,16,valid,select,M,迷惑メール関連法で表示義務に含まれないものはどれか、次の選択肢の中から１つ選びなさい,送信者の氏名または名称及び住所,受信者の本名,否定者からの通知を受けるための、送信者の受信用の電子メールアドレス,特定電子メールである旨(件名欄に「未承認広告」など),,,受信者の本名,,0,0
80,16,valid,select,M,RFCについて説明として適切なものはどれか、次の選択肢の中から１つ選びなさい,電気工学、電子工学、および関連した技術を扱う国際的な標準化団体のこと,電気通信事業者向けの情報セキュリティマネジメントシステムのこと,ネットワーク上の異なるPCで処理を実行する手続きのこと,インターネットで利用される技術の標準仕様のこと,,,インターネットで利用される技術の標準仕様のこと,,0,0
81,1,valid,select,M,JISQ27002:2006に示されている情報セキュリティの６つの要素に含まれないものはどれか、次の選択肢の中から１つ選びなさい。,真正性,信頼性,追随性,機密性,,,追随性,,0,0
82,1,valid,select,M,計画したプロセスとを実施する段階は「PDCAサイクル」のどの段階か、次の選択肢の中から１つ選びなさい,PLAN,DO,CHECK,ACT,,,DO,,0,0
83,1,valid,select,M,検証するプロセスを実施する段階は「PDCAサイクル」のどの段階か、次の選択肢の中から１つ選びなさい,DO,PLAN,ACT,CHECK,,,CHECK,,0,0
84,1,valid,select,M,情報セキュリティポリシーの説明として適切なものはどれか、次の選択肢の中から１つ選びなさい,情報セキュリティポリシーは、情報システム部の部門長から認証されるべきものである,情報セキュリティポリシーの基本方針には、具体的な手順まで記述しない,情報セキュリティポリシーは、必ず３階層で構成される,情報セキュリティポリシーの内的な効果は、特になく外的な効果のみである,,,情報セキュリティポリシーの基本方針には、具体的な手順まで記述しない,,0,0
85,1,valid,select,M,情報セキュリティマネジメントシステムの要求事項を定義しているJIS規格はどれか、次の選択肢の中から１つ選びなさい,JIS X 5070,JIS Q 27001,JIS Q 27002,JIS Q 15001,,,JIS Q 27001,,0,0
86,2,valid,select,M,セキュリティを考慮した機材等の取り扱いとして適切でないものはどれか、次の選択肢の中から１つ選びなさい,格納場所がすぐわかるように、「ノートPC在中」と書いたラベルをロッカーに書いておく,ノートPC内のファイルにパスワードを設定して、関係者以外に見せないようにする,機密情報の入ったロッカーは、施錠する,ノートPCのUSBポートを利用したセキュリティキーを使用する,,,格納場所がすぐわかるように、「ノートPC在中」と書いたラベルをロッカーに書いておく,,0,0
87,2,valid,select,M,ソーシャルエンジニアリングの攻撃方法の説明として適切でないものはどれか、次の選択肢の中から１つ選びなさい,外部からリモート接続でネットワークに入り込もうとする,ディスプレイを覗いて、機密情報を得る,社員を装って電話をかけ、パスワードを聞き出す,清掃員になり、ゴミから重要情報を持ち出す,,,外部からリモート接続でネットワークに入り込もうとする,,0,0
88,2,valid,select,M,セキュリティポリシーの教育について適切な時期を、次の選択肢の中から１つ選びなさい,人事異動時,採用時,休職時,昇格時,,,採用時,,0,0
89,3,valid,select,M,VPNの構成要素として適切でないものはどれか,スイッチ,トンネリング,暗号化,認証,,,スイッチ,,0,0
90,2,valid,select,M,人事管理に関する記述のうち、適切なものはどれか、次の選択肢の中から１つ選びなさい,職員採用時に、機密保持契約を結ぶ,職員が退職しても、当分はその職員のアカウントを保持させる,職員が休職した際には、その職員のアカウントを削除する,人事異動があるごとにサイトごとのポリシー教育は行えないので、採用時に徹底して行う,,,職員採用時に、機密保持契約を結ぶ,,0,0
91,2,valid,select,M,セキュリティ事件・事故が起こったときに備え、行っておくべきこととして適切なものはどれか、次の選択肢の中から１つ選びなさい,セキュリティポリシーの策定,教育委員会の設立,組織図の再編成,事業継続計画の決定,,,事業継続計画の決定,,0,0
92,2,valid,select,M,施設の入退出管理の施策として適切でないものはどれか、次の選択肢の中から１つ選びなさい,身分証の携帯を徹底,入退出の記録を取る,施設区分を行う,情報の取り扱いを決める,,,情報の取り扱いを決める,,0,0
93,3,valid,select,M,TCP/IPネットワーク・モデルの「インターネット層」は、OSI基本参照モデルのどの層にあてはまりますか、次の選択肢の中から１つ選びなさい,トランスポート層,データリンク層,セッション層,ネットワーク層,,,ネットワーク層,,0,0
94,5,valid,select,M,主にTCPヘッダ、IPヘッダをもとにアクセスコントロールを行うファイアウォールの技術はどれですか,パケットフィルタリング,アプリケーションゲートウェイ,IDS,サーキットレベルゲートウェイ,,,パケットフィルタリング,,0,0
95,3,valid,select,M,UDPの特徴として当てはまるものはどれか、次の選択肢の中から１つ選びなさい,コネクション型,TCPと比較して、軽量なプロトコル,TCPと比較して、信頼性に優れている,TCPと比較して、オーバーヘッドが多い,,,TCPと比較して、軽量なプロトコル,,0,0
96,3,valid,select,M,VPNの特徴として適切なものはどれか、次の選択肢の中から１つ選びなさい,拠点間通信でVPNを使用する場合は、各拠点で使用するプロトコルはIPに限定される,メッセージの改ざんの有無を確認する用途では使用されない,第三者による盗聴を困難にすることができる,インターネットを利用するため、専用線を導入するよりコストが高くなる,,,第三者による盗聴を困難にすることができる,,0,0
97,3,valid,select,M,無線LANで利用されるSSIDの説明として適切でないものはどれか、次の選択肢の中から１つ選びなさい,無線LAN端末の集合をグループ化するための文字列である,MACアドレスフィルタリングと同じく、認証の機能を実装する,WEPで使用される暗号化技術のうちの一部である,通信可能な無線LAN端末を識別するためのものであり、セキュリテイ対策技術ではない,,,WEPで使用される暗号化技術のうちの一部である,,0,0
98,3,valid,select,M,無線LANで利用されるSSIDの説明として適切でないものはどれか、次の選択肢の中から１つ選びなさい,MACアドレスフィルタリング,データの暗号化,ポートスキャン,接続の認証,,,ポートスキャン,,0,0
99,7,valid,select,M,次の内メールクライアントの運用としてセキュリティ的に好ましくないと思われるのはどれですか。,仕事中こまめにメールを受信する,知り合いからのメールであれば添付ファイルの種類に問わず保存、実行する,メールクライアントソフトを最新の状態に保つ,メールを受信するときのパスワードを定期的に変える,,,知り合いからのメールであれば添付ファイルの種類に問わず保存、実行する,,0,0
100,4,valid,select,M,パスワードクラックの方法として該当しないものはどれか、次の選択肢の中から１つ選びなさい,DoS攻撃,辞書攻撃,総当り攻撃,ソーシャルエンジニアリング攻撃,,,DoS攻撃,,0,0
101,4,valid,select,M,DoS攻撃の説明として適切なものはどれか、次の選択肢の中から１つ選びなさい,DOSというOS(オペレーティングシステム)を使用した攻撃,大量のパケットや処理できない不正なパケットを送りつけ、ネットワークサービスを利用できなくしてしまう攻撃,プログラムの不具合を悪用し、不正なコードを送信することで相手のOSを乗っ取る攻撃,不正な手段でパスワードを解析する攻撃,,,大量のパケットや処理できない不正なパケットを送りつけ、ネットワークサービスを利用できなくしてしまう攻撃,,0,0
102,4,valid,select,M,ネットワークでの盗聴によって引き起こされる問題はどれか、次の選択肢の中から１つ選びなさい,機密性が損なわれる,完全性が損なわれる,可用性が損なわれる,真正性が損なわれる,,,機密性が損なわれる,,0,0
103,4,valid,select,M,特定のサーバやネットワークに対して、過度な負荷をかけることにより、サービス提供を停止させたりする攻撃手法はどれか、次の選択肢の中から１つ選びなさい,パケットフィルタリング,DoS攻撃,総当り攻撃,ソーシャルエンジニアリング,,,DoS攻撃,,0,0
104,8,valid,select,M,次のうちファイルやディレクトリに対し、アクセス制限がかけられないファイルシステムはどれですか。,FAT,NTFS,ext3,UFS,,,FAT,,0,0
105,4,valid,select,M,Whoisデータベースから入手できる情報として該当しないものはどれか、次の選択肢の中から一つ選びなさい,DNSサーバのIPアドレス,利用しているプロバイダの情報,メールサーバのIPアドレス,ドメイン管理者名の連絡先,,,利用しているプロバイダの情報,,0,0
106,5,valid,select,M,ファイアウォールの説明として適切でないものはどれか、次の選択肢の中から１つ選びなさい,許可されたユーザやノードが許可された範囲内でアクセスできるように制御する,アプライアンスだけではなく、OSのネットワーク機能によっても実装できる,不正アクセスの検知を行える,ファイアウォールは内部LANでも使用する,,,不正アクセスの検知を行える,,0,0
107,5,valid,select,M,ファイアウォールのアクセスコントロールの種類であるサーキットレベルゲートウェイはOSI基本参照モデルにおいてどの層での制御を行っているか、次の選択肢の中から１つ選びなさい,データリンク層,ネットワーク層,トランスポート層,アプリケーション層,,,トランスポート層,,0,0
108,5,valid,select,M,ファイアウォールのアクセスコントロールの種類でないものはどれか、次の選択肢の中から１つ選びなさい,サーキットレベルゲートウェイ,パケットフィルタリング,スパイウェア,アプリケーションゲートウェイ,,,スパイウェア,,0,0
109,8,valid,select,M,「TrustedOS」「セキュアOS」ではどのアクセス制御を用いますか。,強制アクセス制御,任意アクセス制御,評価アクセス制御,準拠アクセス制御,,,強制アクセス制御,,0,0
110,5,valid,select,M,ファイアウォールの導入や設計に関する説明として最も適切なものはどれか、次の選択肢の中から１つ選びなさい,アクセス制御ポリシーは許可すべき通信だけを定義し、それ以外は禁止するように設定することが望ましい,ファイアウォールのログは非常に大きいが、１日に１度は全てのログに目を通すべきである,DMZはファイアウォールの機能の１つであり、ファイアウォールの導入にあっては必ず設ける必要がある,ファイアウォールのログはその日に確認しなければ意味がないので、定期検査はあまり意味を持たない,,,アクセス制御ポリシーは許可すべき通信だけを定義し、それ以外は禁止するように設定することが望ましい,,0,0
111,6,valid,select,M,IDSの導入目的として、最も適切なものはどれか、次の選択肢の中から１つ選びなさい,不正アクセスを防御する,不正アクセスを検知する,改ざんされたファイルの検知及び修正,パケットフィルタリングによるアクセスコントロールの実施,,,不正アクセスを検知する,,0,0
112,6,valid,select,M,ネットワーク型IDS(NIDS)の機能の説明として適切でないものはどれか、次の選択肢の中から１つ選びなさい,システム上の保存されるログを解析するためにリアルタイムで不正アクセスを検知できない,ローカル端末内で完結してしまう不正アクセス（コンソール上からのハッキング、ローカルDoS、ローカルバッファーオーバーフロー)は検知できない,暗号化された通信上で行なわれる不正アクセスは検知できない,スイッチングHubのミラーポートを利用した場合、同セグメント内の全ての不正アクセスを監視できる,,,システム上の保存されるログを解析するためにリアルタイムで不正アクセスを検知できない,,0,0
113,5,valid,select,M,アプリケーションゲートウェイの説明として適切でないものはどれか、次の選択肢の中から１つ選びなさい,Proxyサーバ(代理サーバ)として広く普及,パケットフィルタリングに比べて高速,アプリケーションプロトコルの内容に基づいた処理が可能,IPアドレスの共有やクライアントの隠蔽,,,パケットフィルタリングに比べて高速,,0,0
114,9,valid,select,M,次の認証プロトコルでクリアテキストで認証情報が送受信されるのはどれですか。,Kerberos,CHAP,PAP,NTLM,,,PAP,,0,0
115,6,valid,select,M,IDSの運用時の留意点の説明として、適切でないものはどれか、次の選択肢の中から１つ選びなさい,検知されたIDSのイベントへ的確に対応できるようにIDSの管理者は常にセキュリティ情報に精通しておく,IDSのソフトウェアのバージョンは常に最新にしておく,IDSがシステムを強化しているため個々のシステムへのメンテナンス(パッチあて、バージョンアップ)は行わなくて良い,IDSは不正アクセスを検知するのが目的であるため、IDSを導入することにより個々のシステムが強化されるわけではない。,,,IDSがシステムを強化しているため個々のシステムへのメンテナンス(パッチあて、バージョンアップ)は行わなくて良い,,0,0
116,7,valid,select,M,DNSで考えられる脅威として当てはまらないものはどれか、次の選択肢の中から１つ選びなさい,盗聴,キャッシュの改ざん,不正なゾーン転送要求,DoS攻撃,,,盗聴,,0,0
117,7,valid,select,M,メールサーバに対応する脅威として当てはまらないものはどれか、次の選択肢の中から１つ選びなさい,SQLインジェクション,不正中継,ウイルス感染,スパムメール,,,SQLインジェクション,,0,0
118,7,valid,select,M,SMTPサーバを踏み台にして利用する理由として適切なものはどれか、次の選択肢の中から１つ選びなさい,スパムメールなどを送信する際に自分の正体を隠すため,メールを送信する際の認証、暗号化のため,IPアドレスを共有し、インターネットのアクセスするため,メールの添付のウイルスチェックのため,,,スパムメールなどを送信する際に自分の正体を隠すため,,0,0
119,10,valid,select,M,オブジェクト指向プログラミングの三大要素は次のうち、どれですか。,カプセル化、継承、ポリモーフィズム,カプセル化、隠蔽、ポリモーフィズム,カプセル化、再利用、ポリモーフィズム,カプセル化、高速化ポリモーフィズム,,,カプセル化、継承、ポリモーフィズム,,0,0
120,7,valid,select,M,Webサービスを利用する上での注意点やセキュリティ対策に関する説明として最も適切なものはどれか、次の選択肢の中から１つ選びなさい,Webアプリケーションの脆弱性による脅威を回避するためにはプラウザを常に最新状態にしておく必要がある,Basic認証は、パスワードは暗号化されない,ブラウザのセキュリティレベルを上げることで不正プログラムのダウンロードを防ぐ,CookieやセッションIDを用いることでなりすましを防ぐ,,,Basic認証は、パスワードは暗号化されない,,0,0
121,8,valid,select,M,OSのサービス管理の説明として適切でないものはどれか、次の選択肢の中から１つ選びなさい。,サービスとはユーザにより実行されるアプリケーションのことである,Windowsの「サービス」では、起動や停止を指定するだけでなく、無効にして手動でも実行ができないように設定することができる,UNIXではサービスの起動と停止の方法はOSごとに異なるが、多くの場合はスクリプトを使用する,システム上で稼働しているサーブスの確認方法はOSごとに用意されている,,,サービスとはユーザにより実行されるアプリケーションのことである,,0,0
122,8,valid,select,M,OSのファイルシステムに関する説明として適切でないものはどれか、次の選択肢の中から１つ選びなさい。,ファイルの所有者やアクセス権の情報を持つファイルシステムでは、これらの情報によってアクセスコントロールが行える,Windowsのファイルシステムである「FAT」はアクセス権を持たないので「NTFS」を利用することが望ましい,UNIXで使用するファイルシステムは所有者やアクセス権の情報を持つ,ファイルシステムのアクセス権はネットワーク経由のアクセス権には関係ないのでネットワーク経由でのアクセス権を別途設定しなければならない,,,ファイルシステムのアクセス権はネットワーク経由のアクセス権には関係ないのでネットワーク経由でのアクセス権を別途設定しなければならない,,0,0
123,8,valid,select,M,UNIXコンソールにおいて、rootアカウントで使用する際にプロンプトの末尾に記載されている記号はどれか、次の選択肢の中から１つ選びなさい,#,$,%,@,,,#,,0,0
124,11,valid,select,M,アンチウイルスソフトでパターンマッチングの検知方法に使われるデータベースをなんといいますか。,ウィルス定義ファイル,ルールベース定義ファイル,ヒューリスティック定義ファイル,ビヘイビア定義ファイル,,,ウィルス定義ファイル,,0,0
