125,8,valid,select,M,修正プログラムやログなどの管理に関する説明として適切でないものはどれか、次の選択肢の中から１つ選びなさい,プログラムの不具合に関する情報が報告されたら、即座に修正プログラムの適用を行う,UNIXでは修正プログラムの適用方法はディストリビューションごとに違う,ログファイルは一定期間、管理保存する必要がある,UNIXでは「Syslog」、Windowsでは「イベントビューア」によってログの管理が行える,,,プログラムの不具合に関する情報が報告されたら、即座に修正プログラムの適用を行う,,0,0
126,8,valid,select,M,ログファイルの利用方法として適切でないものはどれか、次の選択肢の中から１つ選びなさい,インシデントへの対応,ログインの抑制,不正の兆候の検知,フォレンジック,,,ログインの抑制,,0,0
127,9,valid,select,M,ユーザを表す「ID」と本人しか知らない記憶、知識との組み合わせで確認する認識方式はどれか、次の選択肢の中から１つ選びなさい,バイオメトリックス認証,パスワード認証,デバイス認証,ワンタイムパスワードによる認証,,,パスワード認証,,0,0
128,9,valid,select,M,パスワード認証の設定上の注意点として適切でないものはどれか、次の選択肢の中から１つ選びなさい,アルファベットのみを使用する,定期的に更新する,アカウント名とパスワードは同一にしない,以前使ったパスワードは再使用しない,,,アルファベットのみを使用する,,0,0
129,9,valid,select,M,アクセス権がシステムによって決定される制御方式はどれか、次の選択肢の中から１つ選びなさい,任意アクセス制御(DAC),強制アクセス制御(MAC),役割に基づくアクセス制限(RBAC),ポリシーに基づくアクセス制御,,,強制アクセス制御(MAC),,0,0
130,9,valid,select,M,パスワード認証の運用上の注意点として適切でないものはどれか、次の選択肢の中から１つ選びなさい,パスワードは一定文字以上のものを使用する,パスワードを共有する場合は限られた管理者のみに限定する,アカウント名とパスワードは同一のものを使用しない,デフォルトのパスワードは使用しない,,,パスワードを共有する場合は限られた管理者のみに限定する,,0,0
131,9,valid,select,M,RASや無線LANなど１つの認証情報を複数の認証サーバで共有できる認証の仕組みはどれか、次の選択肢の中から１つ選びなさい,Kerberos,802.1X,RADIUS,NTLM,,,RADIUS,,0,0
132,9,valid,select,M,シングルサインオンを実装するために用いるプロトコルとして適切なものはどれか、次の選択肢の中から１つ選びなさい,RADIUS,802.1X,Kerberos,CHAP,,,Kerberos,,0,0
133,10,valid,select,M,プログラム言語であるCの説明して適切なものはどれか、次の選択肢の中から１つ選びなさい,システム(OS等)の記述用に開発された,HTML拡張として利用される,オブジェクト指向である,インタプリタ形式のスクリプト言語である,,,システム(OS等)の記述用に開発された,,0,0
134,10,valid,select,M,バッファーオーバーフローの説明して最も適切なものはどれか、次の選択肢の中から１つ選びなさい,仮想メモリが確保している容量以上のデータが入力されること,実メモリが確保している容量以上のデータが入力されること,メモリ上のバッファが確保している容量以上のデータが入力されること,HDDのバッファが確保している容量以上のデータが入力されること,,,メモリ上のバッファが確保している容量以上のデータが入力されること,,0,0
135,10,valid,select,M,オブジェクト指向プログラミングで実現できることは何か、次の選択肢の中から１つ選びなさい,プログラムのGUI化,データの隠蔽,なりすましの防止,トンネリング,,,データの隠蔽,,0,0
136,10,valid,select,M,オブジェクト指向プログラミングの特徴である3つの要素以外の者はどれか、次の選択肢の中から１つ選びなさい,継承,カプセル化,マークアップ,ポリモーフィズム,,,マークアップ,,0,0
138,11,valid,select,M,不正プログラムの動作とそれに対する対応についての説明として当てはまらないものはどれか、次の選択肢の中から１つ選びなさい,ウィルス対策ソフトを強制終了してしまうことがある。この様な不正プログラムにはウィルス対策ソフトの集中管理システムを使用することが効果がある,hostsファイルを書き換えて不正なWebサイトへ誘導してしまう。この様な不正プログラムへの対応の１つとしてhostsファイルを使用していないのであれば、書き込み禁止にしておく,メールサーバ(SMTPサーバ)として動作し、スパムメールの踏み台として利用されてしまう。この様な不正プログラムにはパケットフィルタは効果がある,不正にインストールされたプログラムが外部からの指示でDoS攻撃を行う。このようなプログラムはログインしていなければ動作しない,,,不正にインストールされたプログラムが外部からの指示でDoS攻撃を行う。このようなプログラムはログインしていなければ動作しない,,0,0
139,11,valid,select,M,プログラムファイルの実行前にコードからそのプログラムの動作を分析し、不正な動作かどうかで不正プログラムを検知する方法を何と呼ぶか、次の選択肢の中から１つ選びなさい,パターンマッチング,ビヘイビア,ヒューリスティック,異常検知,,,ヒューリスティック,,0,0
140,11,valid,select,M,不正プログラムの検知方法に関する説明として適切なものはどれか、次の選択肢の中から１つ選びなさい,パターンマッチングでは定義ファイルだけに頼らない検知方法である,ビヘイビアによる検知方法はまだ発見されていない不正プログラムを検出するために用いられる,ビヘイビアは定義ファイルを用いて検出する,ヒューリスティックは既知のウィルス検出に用いられる,,,ビヘイビアによる検知方法はまだ発見されていない不正プログラムを検出するために用いられる,,0,0
141,12,valid,select,M,対象鍵暗号(共通鍵暗号)による暗号化通信をインターネットで利用する際にどのような問題があるのか、次の選択肢の中から１つ選びなさい,問題はない,公開鍵と秘密鍵のうち、公開鍵の改ざんを防ぐため方法,公開鍵と秘密鍵のうち、秘密鍵を誰にも知られないように保管する方法,暗号化に用いる鍵データを送信者が誰にも知られることなく受信者に渡す方法,,,暗号化に用いる鍵データを送信者が誰にも知られることなく受信者に渡す方法,,0,0
142,12,valid,select,M,共通鍵暗号のアルゴリズムはどれか、次の選択肢の中から１つ選びなさい,CHAP,AES,RSA,MD5,,,AES,,0,0
143,12,valid,select,M,共通鍵暗号方式での問題点はどれか、次の選択肢の中から１つ選びなさい,暗号化、復号の処理時間,鍵長,システムへの負荷,鍵交換,,,鍵交換,,0,0
144,13,valid,select,M,インターネット上の脅威の中で、電子署名と関係がないものはどれか、次の選択肢の中から１つ選びなさい,改ざん,盗聴,否認,ウィルス,,,ウィルス,,0,0
145,13,valid,select,M,ハッシュの説明として適切なものはどれか、次の選択肢の中から１つ選びなさい,ハッシュ値から一定の法則で元の平文を求めることができる,ハッシュ値の長さは元の平文の大きさに依存する,同じ平文からは同じハッシュ値が求められるが、僅かな違いに対しても大きく異なるハッシュ値となる,ハッシュとは復号アルゴリズムの１つである,,,同じ平文からは同じハッシュ値が求められるが、僅かな違いに対しても大きく異なるハッシュ値となる,,0,0
146,13,valid,select,M,ハッシュアルゴリズムはどれか、次の選択肢の中から１つ選びなさい,RSA,W3C,WPA,MD5,,,MD5,,0,0
147,13,valid,select,M,公開鍵暗号方式による電子署名に関する説明として適切なものはどれか、次の選択肢の中から１つ選びなさい,秘密鍵が第三者に知られてはいけない,電子署名の技術は秘密鍵で暗号化を行うので機密性も確保される,電子署名データは元の平文とデータサイズが同じである,インターネットにおける電子署名の利用では内容の秘匿性を高めるために暗号化を行う,,,秘密鍵が第三者に知られてはいけない,,0,0
148,14,valid,select,M,電子証明書に含まれないデータはどれか、次の選択肢の中から１つ選びなさい,申請者の公開鍵,申請者の秘密鍵,申請者の情報,認証局署名,,,申請者の秘密鍵,,0,0
149,14,valid,select,M,電子証明書の説明として適切なものはどれか、次の選択肢の中から１つ選びなさい,JISで認定された機関が発行するデータ,アナログではなく、デジタルデータであることを示すデータ,暗号化通信を行うための暗号鍵のデータ,添付された公開鍵が電子証明書の申請者のものであることを証明するデータ,,,添付された公開鍵が電子証明書の申請者のものであることを証明するデータ,,0,0
150,14,valid,select,M,認証局の役割として適切でないものはどれか、次の選択肢の中から１つ選びなさい,電子証明書の発行,電子証明書の申請者の実在確認,電子証明書の利用,失効した電子証明書管理,,,電子証明書の利用,,0,0
151,14,valid,select,M,PKIの構成要素として含まれないものはどれか、次の選択肢の中から１つ選びなさい,電子署名法,公開鍵暗号方式,電子証明書,ネットワーク,,,ネットワーク,,0,0
152,15,valid,select,M,メッセージを暗号化し、利用者相互の署名で検証を行う「信頼の輪」の方式を行っているプロトコルはどれか、次の選択肢の中から１つ選びなさい,SSH,TLS(SSL),PGP,S/MIME,,,PGP,,0,0
153,15,valid,select,M,セキュリティプロトコルの説明として適切でないものはどれか、次の選択肢の中から１つ選びなさい,PGPやS/MIMEはメールデータの暗号化を行う,SSHはトランスポート層より上の層で実装されるプロトコルである,TLS(SSL)は相手の認証や鍵交換を行うため、公開鍵の取得が必要になる,IPsecは機能の一部として、TLS(SSL)による暗号化と認証が利用できる,,,IPsecは機能の一部として、TLS(SSL)による暗号化と認証が利用できる,,0,0
154,15,valid,select,M,TLS(SSL)プロトコルについて適切でないものはどれか、次の選択肢の中から１つ選びなさい,TLS(SSL)はアプリケーション層とは独立している,TLS(SSL)では複数の暗号技術を利用している,TLS(SSL)を利用した HTTPプロトコルをHTTPSと呼ぶ,TLS(SSL)はHTTPプロトコルと一緒にしか利用できない,,,TLS(SSL)はHTTPプロトコルと一緒にしか利用できない,,0,0
155,16,valid,select,M,電気工学、電子工学および関連した技術を扱う国際的な標準化団体はどれか、次の選択肢の中から１つ選びなさい,ITU,IEC,IETF,OECD,,,IEC,,0,0
156,16,valid,select,M,日本国内で製造・使用される様々な鉱・工業製品などの国家規格はどれか、次の選択肢の中から１つ選びなさい,JIS,ISO,IEC,W3C,,,JIS,,0,0
157,16,valid,select,M,出版物の保護、盗作への罰則などに関する取り決めを定めた法律はどれか、次の選択肢の中から１つ選びなさい,高度情報処理ネットワーク社会形成基本法,特許法,意匠法,著作権法,,,著作権法,,0,0
158,16,valid,select,M,情報セキュリティマネジメントの要求事項の国際標準規格はどれか、次の選択肢の中から１つ選びなさい,ISO/IEC17799(ISO/IEC27002),I/SOIEC15408,ISO/IEC27001,ISO/IEC13335,,,ISO/IEC27001,,0,0
159,16,valid,select,M,「不正アクセス行為の禁止等に関する法律」により処罰の対象となる行為はどれか、次の選択肢の中から１つ選びなさい,他人のIDおよびパスワードを入力した,同僚がパソコン上で作成しているデータを背後から覗き見た,サーバ上の共有ファイルを誤って消去してしまった,パソコンショップに展示してあるパソコンにパスワードを設定した,,,他人のIDおよびパスワードを入力した,,0,0
160,16,valid,select,M,個人情報を取り扱う業者の義務でないものはどれか、次の選択肢の中から１つ選びなさい,個人情報の利用目的の特定、利用目的外利用の制限,苦情の申し立ての処理,データベースの構造提示,個人データの安全管理措置,,,データベースの構造提示,,0,0